{
  "artifact_class": "A-BCREQ",
  "state": "draft",
  "task_id": "TASK-0975",
  "format_class": "F-APPROVAL",
  "projection": "V-APPROVE",
  "products": [
    {
      "marker": "А",
      "product_class": "contact-center",
      "atomic_function": "настройка параметров кампании исходящего обзвона",
      "profile": "P-SETTINGS"
    }
  ],
  "slots": {
    "S-GLOSSARY": {
      "heading": "Термины и определения",
      "filled": true,
      "content": "Из словаря домена: «ИО» (TRM-OUTBOUND). Термины «Звонковая задача», «Попытка дозвона», «Неэффективный звонок» во входе определены Заказчиком и приняты как термины задачи со ссылкой на SRC-01; в словарь домена они вносятся отдельной задачей, а не по ходу прогона."
    },
    "S-PROBLEM": {
      "heading": "Проблема, цель, границы изменения",
      "filled": true,
      "content": "Проблема: короткие по длительности попытки дозвона учитываются в статистике как успешные и искажают её. Цель: дать возможность задавать порог эффективности попытки дозвона и правила повторов при её неэффективности. Реестр продуктов: [А] contact-center, настройка параметров кампании ИО, P-SETTINGS."
    },
    "S-SCOPE": {
      "heading": "Текущее состояние и требуемая дельта",
      "filled": true,
      "content": "Текущее состояние: успешность попытки дозвона определяется фактом соединения. Дельта: добавляется сравнение длительности попытки с порогом. Формулировка текущего состояния взята из SRC-01 («попадают в статистику как успешные»), внешние источники не использовались."
    },
    "S-SOLUTION": {
      "heading": "Описание решения",
      "filled": true,
      "content": "В настройки кампании ИО вводится порог длительности эффективной попытки дозвона и два зависимых параметра: предельное число неэффективных попыток и пауза перед повторной попыткой после неэффективной. Те же параметры доступны через внешние API-методы."
    },
    "S-FR": {
      "heading": "Функциональные требования",
      "filled": true,
      "content": "ФТ-01. Система должна предоставлять Пользователю возможность задавать минимальную длительность эффективной Попытки дозвона в настройках Кампании ИО (SRC-01). ФТ-02. Система должна предоставлять Пользователю возможность задавать предельное количество неэффективных Попыток дозвона (SRC-01). ФТ-03. Система должна предоставлять Пользователю возможность задавать паузу перед повторной Попыткой дозвона после неэффективной попытки (SRC-01). ФТ-04. Система должна определять успешность Попытки дозвона сравнением её длительности со значением параметра «Неэффективный звонок» (SRC-01). ФТ-05. Система должна предоставлять возможность задавать и изменять параметры ФТ-01…ФТ-03 через внешние API-методы (SRC-01)."
    },
    "S-SETTINGS": {
      "heading": "Пользовательские настройки",
      "filled": true,
      "content": "Три параметра кампании ИО: «Неэффективный звонок» (длительность), предельное число неэффективных попыток, пауза перед повторной попыткой. Единицы измерения, диапазоны и значения по умолчанию во входе не заданы и вынесены в Q-01."
    },
    "S-UI": {
      "heading": "UI-логика",
      "filled": false,
      "empty_reason": "вынесено в открытые вопросы"
    },
    "S-SCENARIO": {
      "heading": "Сценарии использования",
      "filled": true,
      "content": "СЦ-01. Попытка дозвона завершилась с длительностью меньше порога → попытка признаётся неэффективной, счётчик неэффективных попыток увеличивается (ФТ-04). СЦ-02. Счётчик неэффективных попыток достиг предела → повторные попытки по Звонковой задаче прекращаются (ФТ-02). СЦ-03. Параметры заданы через внешний API → применяются те же правила, что и при настройке в интерфейсе (ФТ-05)."
    },
    "S-AC": {
      "heading": "Критерии приёмки",
      "filled": true,
      "content": "КП-01. Параметры ФТ-01…ФТ-03 сохраняются в настройках кампании ИО и применяются к новым попыткам дозвона. КП-02. Попытка дозвона длительностью меньше порога не учитывается как успешная. КП-03. Изменение параметров через API даёт то же поведение, что и изменение в интерфейсе. Критерии выведены из ФТ, во входе явного перечня критериев приёмки нет."
    },
    "S-NFR": {
      "heading": "Нефункциональные требования",
      "filled": false,
      "empty_reason": "нет в источнике"
    },
    "S-LIMITS": {
      "heading": "Ограничения",
      "filled": true,
      "content": "Границы смежных понятий словаря (EP-G7): «ИО» / исходящий обзвон (TRM-OUTBOUND) — включено; «Входящие» (TRM-INBOUND) — исключено, параметры эффективности к входящему потоку не применяются."
    },
    "S-OPEN": {
      "heading": "Открытые вопросы",
      "filled": true,
      "content": "Q-01 (AMB-01, квантитативная, blocker): единицы измерения, диапазон и значение по умолчанию порога «Неэффективный звонок»; адресат — Заказчик. Q-02 (AMB-02, референциальная, major): наименования и расположение элементов интерфейса настройки; адресат — владелец продукта КЦ. Q-03 (AMB-03, модальная, major): распространяются ли новые правила на уже созданные кампании ИО; адресат — Заказчик."
    },
    "S-TRACE": {
      "heading": "Прослеживаемость",
      "filled": true,
      "content": "Таблица приведена в поле trace настоящего артефакта."
    },
    "S-INTEGRATION": {
      "heading": "Внешние интерфейсы",
      "filled": true,
      "content": "Внешние API-методы создания и изменения кампании ИО расширяются тремя параметрами (ФТ-05). Конкретные имена методов во входе не названы и запрошены вопросом Q-02."
    }
  },
  "trace": [
    {
      "requirement_id": "ФТ-01",
      "core_id": "ST-01",
      "source_id": "SRC-01",
      "acceptance_id": "КП-01"
    },
    {
      "requirement_id": "ФТ-02",
      "core_id": "ST-02",
      "source_id": "SRC-01",
      "acceptance_id": "КП-01"
    },
    {
      "requirement_id": "ФТ-03",
      "core_id": "ST-03",
      "source_id": "SRC-01",
      "acceptance_id": "КП-01"
    },
    {
      "requirement_id": "ФТ-04",
      "core_id": "ST-04",
      "source_id": "SRC-01",
      "acceptance_id": "КП-02"
    },
    {
      "requirement_id": "ФТ-05",
      "core_id": "ST-05",
      "source_id": "SRC-01",
      "acceptance_id": "КП-03"
    }
  ]
}
