{
  "artifact_class": "A-BCREQ",
  "state": "draft",
  "task_id": "TASK-1059",
  "format_class": "F-APPROVAL",
  "projection": "V-APPROVE",
  "products": [
    {
      "marker": "А",
      "product_class": "contact-center",
      "atomic_function": "автоматическое распределение обращений на агента",
      "profile": "P-SETTINGS"
    }
  ],
  "slots": {
    "S-GLOSSARY": {
      "heading": "Термины и определения",
      "filled": true,
      "content": "Термины берутся из taxonomy/domain-glossary.yaml: Входящие (TRM-INBOUND), Очередь (TRM-QUEUE), Агент, Слот. Термины «фоновое взаимодействие» и «активное взаимодействие» в словаре отсутствуют и вынесены в S-OPEN (Q-01), а не определены самостоятельно."
    },
    "S-PROBLEM": {
      "heading": "Проблема, цель, границы изменения",
      "filled": true,
      "content": "Проблема: агент КЦ обрабатывает обращения последовательно, ёмкость агента не управляется по каналам. Цель: дать возможность одновременной работы агента максимум с тремя активными контактами с учётом приоритета каналов. Реестр продуктов задачи: [А] contact-center, автоматическое распределение обращений на агента, P-SETTINGS."
    },
    "S-SCOPE": {
      "heading": "Текущее состояние и требуемая дельта",
      "filled": true,
      "content": "Текущее состояние в источнике не описано: SRC-01 задаёт только целевое поведение. Дельта объявлена как «предельные значения по каналам и правило приоритета отсутствуют → вводятся». Ссылка на действующее поведение продукта требует внешнего источника (руководство КЦ), которого во входе нет; запрос зафиксирован как Q-02."
    },
    "S-SOLUTION": {
      "heading": "Описание решения",
      "filled": true,
      "content": "Вводится ёмкость агента, выраженная слотами по типам каналов, и правило выбора канала при наличии свободного слота. E-mail получает признак фонового взаимодействия: его назначение не меняет статус доступности агента."
    },
    "S-FR": {
      "heading": "Функциональные требования",
      "filled": true,
      "content": "ФТ-01. Система должна ограничивать число одновременно назначенных агенту контактов значением 3 (SRC-01). ФТ-02. Система должна ограничивать число одновременно назначенных агенту контактов по типам канала значениями: голос 1, чат 2, e-mail 1 (SRC-01). ФТ-03. Система должна выбирать канал назначения при свободной ёмкости в порядке приоритета: голос, чат, e-mail (SRC-01). ФТ-04. Система не должна переводить агента в статус «Недоступен» при назначении e-mail (SRC-01). ФТ-05. Система должна отражать параллельную обработку в отчётности (SRC-01, критерий приёмки 6)."
    },
    "S-SETTINGS": {
      "heading": "Пользовательские настройки",
      "filled": false,
      "empty_reason": "вынесено в открытые вопросы"
    },
    "S-UI": {
      "heading": "UI-логика",
      "filled": true,
      "content": "Источник требует переключения между всеми активными взаимодействиями без потери контекста (SRC-01, критерий приёмки 7). Конкретные элементы интерфейса во входе не названы; называть их без источника запрещено правилом «утверждение без ссылки на источник фактом не является» — уточнение вынесено в Q-03."
    },
    "S-SCENARIO": {
      "heading": "Сценарии использования",
      "filled": true,
      "content": "СЦ-01. Агент ведёт 1 звонок, ёмкость e-mail свободна → система назначает e-mail, статус агента не меняется (ФТ-02, ФТ-04). СЦ-02. Агент ведёт 1 e-mail, голосовой слот свободен, в очереди звонок и чат → система назначает звонок (ФТ-03). СЦ-03. Агент ведёт 2 чата и 1 e-mail → общий лимит достигнут, новый контакт не назначается (ФТ-01)."
    },
    "S-AC": {
      "heading": "Критерии приёмки",
      "filled": true,
      "content": "КП-01…КП-05 дословно перенесены из SRC-01 (пункты 1–5 раздела «Критерии приемки»). КП-06 «отчётность корректно отражает параллельную обработку» принят как критерий к ФТ-05. КП-07 «интерфейс позволяет переключаться без потери контекста» принят как критерий к S-UI и связан с Q-03."
    },
    "S-NFR": {
      "heading": "Нефункциональные требования",
      "filled": false,
      "empty_reason": "нет в источнике"
    },
    "S-LIMITS": {
      "heading": "Ограничения",
      "filled": true,
      "content": "Границы смежных понятий словаря объявлены явно (EP-G7): «Входящие» (TRM-INBOUND) — включено; «ИО» / исходящий обзвон (TRM-OUTBOUND) — исключено, во входе не упоминается и правилами ёмкости не покрывается."
    },
    "S-OPEN": {
      "heading": "Открытые вопросы",
      "filled": true,
      "content": "Q-01 (AMB-01, терминологическая, major): «фоновое взаимодействие» — термин вне словаря; адресат — владелец продукта КЦ. Q-02 (AMB-02, референциальная, blocker): текущее поведение распределения не описано; адресат — владелец продукта КЦ. Q-03 (AMB-03, референциальная, major): элементы интерфейса переключения не названы; адресат — владелец продукта КЦ. Q-04 (AMB-04, квантитативная, major): где задаются значения лимитов — фиксированы или настраиваются Пользователем; адресат — Заказчик."
    },
    "S-TRACE": {
      "heading": "Прослеживаемость",
      "filled": true,
      "content": "Таблица соответствия требование → ядро → источник → критерий приведена в поле trace настоящего артефакта."
    },
    "S-INTEGRATION": {
      "heading": "Внешние интерфейсы",
      "filled": false,
      "empty_reason": "нет в источнике"
    }
  },
  "trace": [
    {
      "requirement_id": "ФТ-01",
      "core_id": "ST-01",
      "source_id": "SRC-01",
      "acceptance_id": "КП-01"
    },
    {
      "requirement_id": "ФТ-02",
      "core_id": "ST-02",
      "source_id": "SRC-01",
      "acceptance_id": "КП-05"
    },
    {
      "requirement_id": "ФТ-03",
      "core_id": "ST-03",
      "source_id": "SRC-01",
      "acceptance_id": "КП-03"
    },
    {
      "requirement_id": "ФТ-04",
      "core_id": "ST-04",
      "source_id": "SRC-01",
      "acceptance_id": "КП-02"
    },
    {
      "requirement_id": "ФТ-05",
      "core_id": "ST-05",
      "source_id": "SRC-01",
      "acceptance_id": "КП-06"
    }
  ]
}
