{
  "artifact_class": "A-BCREQ",
  "state": "draft",
  "task_id": "TASK-1059",
  "format_class": "F-APPROVAL",
  "projection": "V-APPROVE",
  "products": [
    {
      "marker": "А",
      "product_class": "contact-center",
      "atomic_function": "автоматическое распределение обращений на агента",
      "profile": "P-SETTINGS"
    }
  ],
  "slots": {
    "S-GLOSSARY": {
      "heading": "Термины и определения",
      "filled": true,
      "content": "Термины берутся из taxonomy/domain-glossary.yaml: Входящие (TRM-INBOUND), Очередь (TRM-QUEUE), Агент, Слот. Термины «фоновое взаимодействие» и «активное взаимодействие» в словаре отсутствуют и вынесены в S-OPEN (Q-01), а не определены самостоятельно."
    },
    "S-PROBLEM": {
      "heading": "Проблема, цель, границы изменения",
      "filled": true,
      "content": "Проблема: агент КЦ обрабатывает обращения последовательно, ёмкость агента не управляется по каналам. Цель: дать возможность одновременной работы агента максимум с тремя активными контактами с учётом приоритета каналов. Реестр продуктов задачи: [А] contact-center, автоматическое распределение обращений на агента, P-SETTINGS."
    },
    "S-SCOPE": {
      "heading": "Текущее состояние и требуемая дельта",
      "filled": true,
      "content": "Текущее состояние извлечено из корпуса (SRC-02, уровень ST-2-CORPUS): «Выбирается алгоритм распределения обращений: на наименее загруженного оператора или равномерное распределение. Задается максимальное количество обращений, которые может обрабатывать один сотрудник». Действующая ёмкость задаётся одним числом на сотрудника, без разделения по каналам, а очереди текстовых обращений и звонков независимы (SRC-02). Дельта: ёмкость становится покаНальной (голос 1, чат 2, e-mail 1 фоновый) при общем пределе 3, и вводится правило приоритета канала при свободной ёмкости (SRC-01)."
    },
    "S-SOLUTION": {
      "heading": "Описание решения",
      "filled": true,
      "content": "Вводится ёмкость агента, выраженная слотами по типам каналов, и правило выбора канала при наличии свободного слота. E-mail получает признак фонового взаимодействия: его назначение не меняет статус доступности агента."
    },
    "S-FR": {
      "heading": "Функциональные требования",
      "filled": true,
      "content": "ФТ-01. Система должна ограничивать число одновременно назначенных агенту контактов значением 3 (SRC-01). ФТ-02. Система должна ограничивать число одновременно назначенных агенту контактов по типам канала значениями: голос 1, чат 2, e-mail 1 (SRC-01). ФТ-03. Система должна выбирать канал назначения при свободной ёмкости в порядке приоритета: голос, чат, e-mail (SRC-01). ФТ-04. Система не должна переводить агента в статус «Недоступен» при назначении e-mail (SRC-01). ФТ-05. Система должна отражать параллельную обработку в отчётности (SRC-01, критерий приёмки 6)."
    },
    "S-SETTINGS": {
      "heading": "Пользовательские настройки",
      "filled": true,
      "content": "Настройка выполняется в Личном кабинете ВАТС, раздел «Настройки дозвона и сообщений по умолчанию» (SRC-02). Действующие настраиваемые параметры распределения текстовых обращений: алгоритм распределения (на наименее загруженного оператора либо равномерное) и максимальное количество обращений на одного сотрудника (SRC-02). Требуемая дельта размещается в том же разделе: пределы по каналам и общий предел. Роль, имеющая доступ к настройке, — Руководитель компании и Администратор (SRC-02)."
    },
    "S-UI": {
      "heading": "UI-логика",
      "filled": true,
      "content": "Источник требует переключения между всеми активными взаимодействиями без потери контекста (SRC-01, критерий приёмки 7). Конкретные элементы интерфейса переключения в корпусе на уровне ST-2-CORPUS не найдены и во входе не названы; называть их без источника запрещено, поэтому они вынесены в Q-03."
    },
    "S-SCENARIO": {
      "heading": "Сценарии использования",
      "filled": true,
      "content": "СЦ-01. Агент ведёт 1 звонок, ёмкость e-mail свободна → система назначает e-mail, статус агента не меняется (ФТ-02, ФТ-04). СЦ-02. Агент ведёт 1 e-mail, голосовой слот свободен, в очереди звонок и чат → система назначает звонок (ФТ-03). СЦ-03. Агент ведёт 2 чата и 1 e-mail → общий лимит достигнут, новый контакт не назначается (ФТ-01)."
    },
    "S-AC": {
      "heading": "Критерии приёмки",
      "filled": true,
      "content": "КП-01…КП-05 дословно перенесены из SRC-01 (пункты 1–5 раздела «Критерии приемки»). КП-06 «отчётность корректно отражает параллельную обработку» принят как критерий к ФТ-05. КП-07 «интерфейс позволяет переключаться без потери контекста» принят как критерий к S-UI и связан с Q-03."
    },
    "S-NFR": {
      "heading": "Нефункциональные требования",
      "filled": false,
      "empty_reason": "нет в источнике"
    },
    "S-LIMITS": {
      "heading": "Ограничения",
      "filled": true,
      "content": "Границы смежных понятий словаря объявлены явно (EP-G7): «Входящие» (TRM-INBOUND) — включено; «ИО» / исходящий обзвон (TRM-OUTBOUND) — исключено, во входе не упоминается и правилами ёмкости не покрывается. Дополнительно (SRC-03): все подключённые каналы, включая многоканальный чат, участвуют в автоматическом распределении на одинаковых условиях — введение покаНальных пределов является отклонением от действующего правила и объявлено сознательно."
    },
    "S-OPEN": {
      "heading": "Открытые вопросы",
      "filled": true,
      "content": "Q-01 (AMB-01, терминологическая, major): «фоновое взаимодействие» — термин вне словаря; адресат — владелец продукта КЦ. Q-03 (AMB-03, референциальная, major): элементы интерфейса переключения между активными взаимодействиями не названы ни во входе, ни в корпусе; адресат — владелец продукта КЦ. Q-04 (AMB-04, квантитативная, major): должны ли новые пределы по каналам настраиваться Пользователем или фиксироваться продуктом; адресат — Заказчик. Q-02 снят: ответ получен из корпуса (SRC-02), маршрут не останавливается. Ни одного вопроса класса blocker не осталось."
    },
    "S-TRACE": {
      "heading": "Прослеживаемость",
      "filled": true,
      "content": "Таблица соответствия требование → ядро → источник → критерий приведена в поле trace настоящего артефакта."
    },
    "S-INTEGRATION": {
      "heading": "Внешние интерфейсы",
      "filled": false,
      "empty_reason": "нет в источнике"
    }
  },
  "trace": [
    {
      "requirement_id": "ФТ-01",
      "core_id": "ST-01",
      "source_id": "SRC-01",
      "acceptance_id": "КП-01"
    },
    {
      "requirement_id": "ФТ-02",
      "core_id": "ST-02",
      "source_id": "SRC-01",
      "acceptance_id": "КП-05"
    },
    {
      "requirement_id": "ФТ-03",
      "core_id": "ST-03",
      "source_id": "SRC-01",
      "acceptance_id": "КП-03"
    },
    {
      "requirement_id": "ФТ-04",
      "core_id": "ST-04",
      "source_id": "SRC-01",
      "acceptance_id": "КП-02"
    },
    {
      "requirement_id": "ФТ-05",
      "core_id": "ST-05",
      "source_id": "SRC-01",
      "acceptance_id": "КП-06"
    },
    {
      "requirement_id": "ФТ-02",
      "core_id": "ST-02",
      "source_id": "SRC-02"
    },
    {
      "requirement_id": "ФТ-03",
      "core_id": "ST-03",
      "source_id": "SRC-03"
    }
  ]
}
